"CORPORATE_IDENTIFICATION_NUMBER","DATE_OF_REGISTRATION","COMPANY_NAME","COMPANY_STATUS","COMPANY_CLASS","COMPANY_CATEGORY","AUTHORIZED_CAPITAL","PAIDUP_CAPITAL","REGISTERED_STATE","REGISTRAR_OF_COMPANIES","PRINCIPAL_BUSINESS_ACTIVITY","REGISTERED_OFFICE_ADDRESS","SUB_CATEGORY"
"U51109TR2009PTC008270","21-08-2009","INSYSSKY SOFTTECH PRIVATE LIMITED","ACTIVE","Private","Company Limited by Shares","100,000.00","100,000.00","Tripura","RoC-Shillong","Trading","C/O SUBHRA DEB, VILLAGE JOYNAGAR P.O. TELIAMUNDRA AGARTALA Tripura INDIA 799001","Indian Non-Government Company"
"U51395TR2003PTC007014","27-01-2003","JOYKALI DISTRIBUTORS PRIVATE LIMITED","STRIKE OFF","Private","Company Limited by Shares","1,000,000.00","800,000.00","Tripura","RoC-Shillong","Trading","45 H G BASAK ROAD AGARTALA Tripura INDIA 799001","Indian Non-Government Company"
"U51397TR2002PTC006846","14-06-2002","F.S. REAL ESTATE PRIVATE LIMITED","STRIKE OFF","Private","Company Limited by Shares","20,000,000.00","300,000.00","Tripura","RoC-Shillong","Trading","114 MOTOR STAND ROADAGARTALA WEST TRIPURA Tripura INDIA 799001","Indian Non-Government Company"
"U51432TR2013PTC008385","19-03-2013","TIRTHAMOYEE TRADERS PRIVATE LIMITED","ACTIVE","Private","Company Limited by Shares","30,000,000.00","25,000,000.00","Tripura","RoC-Shillong","Trading","47 CENTRAL ROAD AGARTALA Tripura INDIA 799001","Indian Non-Government Company"
"U51900TR2014PTC008427","20-06-2014","UTKORSH BUSINESS CONSORTIUM PRIVATE LIMITED","ACTIVE","Private","Company Limited by Shares","500,000.00","500,000.00","Tripura","RoC-Shillong","Trading","ABHOYNAGAR, PO- ABHOYNAGAR, AGARTALA NEAR TRIPURA GRAMIN BANK, PS -EAST AGARTALA AGARTALA Tripura INDIA 799005","Indian Non-Government Company"
"U51909TR1975PTC001622","3-06-1975","PAUL BROTHERS ENTERPRISES PVT LTD","STRIKE OFF","Private","Company Limited by Shares","20,000,000.00","2,000,000.00","Tripura","RoC-Shillong","Trading","Hariganga Barak Road Agartala Tripura INDIA","Indian Non-Government Company"
"U51909TR1982PTC001920","21-01-1982","TRIM ASAN INDUSTRIES PVT LTD","ACTIVE","Private","Company Limited by Shares","750,000.00","101,000.00","Tripura","RoC-Shillong","Trading","Laxinarayan Bari Road, Banamalipur, Agartala-799001 WEST TRIPURA Tripura INDIA 799001","Indian Non-Government Company"
"U51909TR1999PTC005744","28-04-1999","DISHA MARKETING PRIVATE LIMITED","STRIKE OFF","Private","Company Limited by Shares","1,000,000.00","3,000.00","Tripura","RoC-Shillong","Trading","SUMAN LODGE DHALESWARAGARTALA WEST TRIPURA, TRIPURA Tripura INDIA 799007","Indian Non-Government Company"
"U51909TR2001PTC006456","20-03-2001","TRIPURESWARI MARKETING PRIVATE LIMITED","STRIKE OFF","Private","Company Limited by Shares","2,000,000.00","500,000.00","Tripura","RoC-Shillong","Trading","49 CENTRAL ROADAGARTALA TRIPURA WEST TRIPURA Tripura INDIA 799001","Indian Non-Government Company"
"U51909TR2004PTC007409","7-05-2004","AGARTALA MARKETING PRIVATE LIMITED","STRIKE OFF","Private","Company Limited by Shares","500,000.00","100,000.00","Tripura","RoC-Shillong","Trading","MILAN CHAKRAP O AD NAGAR WEST AGARTALA TRIPURA Tripura INDIA 799003","Indian Non-Government Company"
"U51909TR2005PTC007844","8-08-2005","NITAI BROTHERS EXPORTS & MONEY CHANGERS PRIVATE LIMITED","STRIKE OFF","Private","Company Limited by Shares","5,000,000.00","250,000.00","Tripura","RoC-Shillong","Trading","KAMARPUKURPARA A ROAD AGARTALA TRIPURA Tripura INDIA 799004","Indian Non-Government Company"
"U51909TR2005PTC008014","28-12-2005","SMARTCARE TRADING SERVICES PRIVATE LIMITED","UNDER PROCESS OF STRIKING OFF","Private","Company Limited by Shares","1,000,000.00","125,000.00","Tripura","RoC-Shillong","Trading","ASSAM AGARTALA ROAD,P.O. RESHAM BAGAN, WEST TRIPURA, AGARTALA-799008. Tripura INDIA","Indian Non-Government Company"
"U51909TR2006PTC008023","2-01-2006","SAHA SEEDS TRADING PRIVATE LIMITED","STRIKE OFF","Private","Company Limited by Shares","500,000.00","100,000.00","Tripura","RoC-Shillong","Trading","MASTER PARA,TOWN PRATAPGARH, AGARTALA, WEST TRIPURA-799001. Tripura INDIA","Indian Non-Government Company"
"U51909TR2006PTC008119","24-04-2006","BUTTERFLY ENTRADE PRIVATE LIMITED","STRIKE OFF","Private","Company Limited by Shares","2,500,000.00","120,000.00","Tripura","RoC-Shillong","Trading","COLONEL CHOWMUHANI NEAR ADJOINING HOTEL LONGTARAI J.N.B. ROAD,AGARTALA TRIPURA WEST Tripura INDIA 799001","Indian Non-Government Company"
"U51909TR2007PLC008240","7-09-2007","SELF TRUST ENTERPRISES LIMITED","UNDER PROCESS OF STRIKING OFF","Public","Company Limited by Shares","20,000,000.00","1,999,900.00","Tripura","RoC-Shillong","Trading","CHANDRAPUR NEW MOTORSTAND AGARTLA Tripura INDIA 799008","Indian Non-Government Company"
"U51909TR2009PTC008257","13-03-2009","TRDP NETWORK MARKETING PRIVATE LIMITED","STRIKE OFF","Private","Company Limited by Shares","100,000.00","100,000.00","Tripura","RoC-Shillong","Trading","NIMBARK ONGC BANK, CHOWMUHANI, A. B. ROAD AGARTALA Tripura INDIA 799014","Indian Non-Government Company"
"U51909TR2009PTC008261","6-05-2009","AGARTALA STEEL TRADERS PRIVATE LIMITED","ACTIVE","Private","Company Limited by Shares","5,000,000.00","1,600,000.00","Tripura","RoC-Shillong","Trading","C/O LAXMI IRON STORES 22, AKHAURA ROAD AGARTALA Tripura INDIA 799001","Indian Non-Government Company"
"U51909TR2010PLC008283","9-02-2010","TIWARY ENTRADE LIMITED","UNDER PROCESS OF STRIKING OFF","Public","Company Limited by Shares","1,000,000.00","500,000.00","Tripura","RoC-Shillong","Trading","VILL BHAGALPUR, NARSINGARH P.O. BIMANGARH. AGARTALA Tripura INDIA 799015","Indian Non-Government Company"
"U51909TR2010PLC008306","12-08-2010","FEARLESS PARIWAR PROJECTS INDIA LIMITED","UNDER PROCESS OF STRIKING OFF","Public","Company Limited by Shares","1,000,000.00","500,000.00","Tripura","RoC-Shillong","Trading","JAIL ASHRAM ROAD P.O. DHALESWAR AGARTALA Tripura INDIA 799007","Indian Non-Government Company"
"U51909TR2010PLC008315","11-11-2010","TRIPURA SUNDARI ENTRADE LIMITED","UNDER PROCESS OF STRIKING OFF","Public","Company Limited by Shares","1,000,000.00","700,000.00","Tripura","RoC-Shillong","Trading","EAST DHWAJANAGAR, NEAR N.H. 44 P.O. GOKULPUR, P.S. R.K. PUR UDAIPUR Tripura INDIA 799114","Indian Non-Government Company"
"U51909TR2010PTC008281","13-01-2010","NEXUS ENTRADE PRIVATE LIMITED","UNDER PROCESS OF STRIKING OFF","Private","Company Limited by Shares","200,000.00","100,000.00","Tripura","RoC-Shillong","Trading","45, H.G. B. ROAD, BACK OF WEST P.S, OPPOSITE OF SARKAR NURSING HOME AGARTALA Tripura INDIA 799001","Indian Non-Government Company"
"U51909TR2010PTC008285","10-02-2010","TRIDEV ENTRADE PRIVATE LIMITED","UNDER PROCESS OF STRIKING OFF","Private","Company Limited by Shares","200,000.00","100,000.00","Tripura","RoC-Shillong","Trading","104, MOTOR STAND AGARTALA TRIPURA Tripura INDIA 799001","Indian Non-Government Company"
"U51909TR2010PTC008288","4-03-2010","OLIVE TOUCH MARKETING INDIA PRIVATE LIMITED","UNDER PROCESS OF STRIKING OFF","Private","Company Limited by Shares","2,000,000.00","300,000.00","Tripura","RoC-Shillong","Trading","MANTRIBARI ROAD AGARTALA Tripura INDIA 799001","Indian Non-Government Company"
"U51909TR2010PTC008289","10-03-2010","TRIPURA PRODUCTS MARKETING PRIVATE LIMITED","ACTIVE","Private","Company Limited by Shares","200,000.00","200,000.00","Tripura","RoC-Shillong","Trading","CHOWDHURY MANJIL , JOGENDRANAGAR OPPOSITE OF VIDYASAGARA GIRLS SCHOOL AGARTALA Tripura INDIA 799010","Indian Non-Government Company"
"U51909TR2010PTC008292","9-04-2010","KAMICHANG MARKETING PRIVATE LIMITED","UNDER PROCESS OF STRIKING OFF","Private","Company Limited by Shares","500,000.00","100,000.00","Tripura","RoC-Shillong","Trading","C/ODINESH DEBBARMA,NEAR WEIGHT & MEASUREMENT OFF PRATAP RAI ROAD, KRISHNA NAGAR AGARTALA Tripura INDIA 799001","Indian Non-Government Company"
"U51909TR2010PTC008294","26-04-2010","HAM SMAI MARKETING PRIVATE LIMITED","UNDER PROCESS OF STRIKING OFF","Private","Company Limited by Shares","500,000.00","500,000.00","Tripura","RoC-Shillong","Trading","1ST FLOOR, BUILDING OF SWAPAN KUMAR MODAK VILL. BANAMALIPUR, OPP. EAST THANA, SADAR AGARTALA Tripura INDIA 799001","Indian Non-Government Company"
"U51909TR2010PTC008297","24-05-2010","AKANSHA (INDIA) ENTRADE PRIVATE LIMITED","ACTIVE","Private","Company Limited by Shares","2,500,000.00","2,300,000.00","Tripura","RoC-Shillong","Trading","31, OFFICE LANE AGARTALA Tripura INDIA 799001","Indian Non-Government Company"
"U51909TR2010PTC008302","20-07-2010","MANORANJAN COMMERCIAL PRIVATE LIMITED","ACTIVE","Private","Company Limited by Shares","30,000,000.00","8,600,000.00","Tripura","RoC-Shillong","Trading","71/1 CENTRAL ROAD AGARTALA Tripura INDIA 799001","Indian Non-Government Company"
"U51909TR2010PTC008313","14-10-2010","LUNA MARKETING INDIA PRIVATE LIMITED","UNDER PROCESS OF STRIKING OFF","Private","Company Limited by Shares","500,000.00","100,000.00","Tripura","RoC-Shillong","Trading","SONALI LASKAR 164, BANAMALIPUR WEST, AGARTALA, AGARTALA Tripura INDIA 799001","Indian Non-Government Company"
"U51909TR2011PLC008328","4-08-2011","SUBHA COMMERCIAL SERVICES LIMITED.","ACTIVE","Public","Company Limited by Shares","20,000,000.00","15,653,800.00","Tripura","RoC-Shillong","Trading","JOYNAGAR 1 NO. AGARTALA Tripura INDIA 799001","Indian Non-Government Company"
"U51909TR2011PTC008332","15-09-2011","BMR COMMERCE & CONCEPTS PRIVATE LIMITED","ACTIVE","Private","Company Limited by Shares","5,000,000.00","4,381,000.00","Tripura","RoC-Shillong","Trading","C/O MADHU SUDHAN SAHA 27, RAMNAGAR MAIN ROAD, P.O. RAMNAGAR, AGARTALA Tripura INDIA 799002","Indian Non-Government Company"
"U51909TR2011PTC008333","20-09-2011","R.A.M. TRADING COMPANY PRIVATE LIMITED","UNDER PROCESS OF STRIKING OFF","Private","Company Limited by Shares","100,000.00","100,000.00","Tripura","RoC-Shillong","Trading","RABINDRA NAGAR DUKLI EAST AGARTALA AGARTALA Tripura INDIA 799001","Indian Non-Government Company"
"U51909TR2011PTC008334","27-09-2011","USHA DEY MARKETING PTIVATE LIMITED","ACTIVE","Private","Company Limited by Shares","100,000.00","100,000.00","Tripura","RoC-Shillong","Trading","MELAR MATH, GANGAIL ROAD TOWN - AGARTALA, SAB DIV-SADAR, DIST - TRIPURA WES AGARTALA Tripura INDIA 799001","Indian Non-Government Company"
"U51909TR2011PTC008338","9-11-2011","VIVEKANANDA TRADE & COMMERCE PRIVATE LIMITED","UNDER PROCESS OF STRIKING OFF","Private","Company Limited by Shares","10,000,000.00","400,000.00","Tripura","RoC-Shillong","Trading","HOSPITAL ROAD EXTENSION PARADISE CHOWMUHANI AGARTALA Tripura INDIA 799001","Indian Non-Government Company"
"U51909TR2012PTC008345","6-02-2012","HAPPYLIFE BUSINESS VENTURES PRIVATE LIMITED","UNDER PROCESS OF STRIKING OFF","Private","Company Limited by Shares","1,000,000.00","150,000.00","Tripura","RoC-Shillong","Trading","Nager Jala, Near Jahar Bridge P.O. A.D. Nagar Agartala Tripura INDIA 799003","Indian Non-Government Company"
"U51909TR2012PTC008358","19-07-2012","GIRIBALA UDYOG PRIVATE LIMITED","ACTIVE","Private","Company Limited by Shares","3,000,000.00","3,000,000.00","Tripura","RoC-Shillong","Trading","542, HARI GANGA BASAK ROAD AGARTALA AGARTALA Tripura INDIA 799001","Indian Non-Government Company"
"U51909TR2012PTC008359","19-07-2012","AARONG UDYOG PRIVATE LIMITED","ACTIVE","Private","Company Limited by Shares","3,000,000.00","3,000,000.00","Tripura","RoC-Shillong","Trading","BIJOY KUMAR CHOWMUHANI KRISHNANAGAR AGARTALA Tripura INDIA 799001","Indian Non-Government Company"
"U51909TR2012PTC008378","24-12-2012","HILL INNOVATIONS PRIVATE LIMITED","ACTIVE","Private","Company Limited by Shares","300,000.00","300,000.00","Tripura","RoC-Shillong","Trading","29, Central Road Kamanchowmani Agartala Tripura INDIA 799001","Indian Non-Government Company"
"U51909TR2014PTC008418","23-01-2014","RUA EXPORT PRIVATE LIMITED","ACTIVE","Private","Company Limited by Shares","1,000,000.00","1,000,000.00","Tripura","RoC-Shillong","Trading","INDRA NAGAR AGARTALA Tripura INDIA 799006","Indian Non-Government Company"
"U51909TR2014PTC008422","19-02-2014","SAIJEE ECO SOLUTION PRIVATE LIMITED","ACTIVE","Private","Company Limited by Shares","100,000.00","100,000.00","Tripura","RoC-Shillong","Trading","348, CHINAIHANI, SINGARBILL, PS-AGARTALA AIRPORT SUB-DIVISION-SADAR, DIST-WEST-TRIPURA, PO-AIRPORT AGARTALA Tripura INDIA 799009","Indian Non-Government Company"
"U52100TR2014OPC008436","17-11-2014","VASKPRASEN LIGHT CARE OPCPRIVATE LIMITED","ACTIVE","One Person Company","Company Limited by Shares","1,000,000.00","100,000.00","Tripura","RoC-Shillong","Trading","HOUSE NO 140889 KHOSH BAGAN, HARIGANGA BASAK ROAD SURJA GHAR BUILDING, HOLDING NO 343, WARD NO 21 HARIGANGA BASAK ROAD AGARTALA Tripura INDIA 799001","Indian Non-Government Company"
"U52200TR2014PTC008435","25-09-2014","SWARNATRISHA HOSPITALITY & CREATIONS PRIVATE LIMITED","ACTIVE","Private","Company Limited by Shares","100,000.00","100,000.00","Tripura","RoC-Shillong","Trading","SOUTH OF UPENDRA SCHOOL WEST JOY NAGAR AGARTALA Tripura INDIA 799001","Indian Non-Government Company"
"U52206TR2011PTC008337","1-11-2011","UDAYAN SALES PRIVATE LIMITED","UNDER PROCESS OF STRIKING OFF","Private","Company Limited by Shares","100,000.00","100,000.00","Tripura","RoC-Shillong","Trading","228, Sonamura; Town/Vill-Rajarbag P S - Radhakishorpur Udaipur Tripura INDIA 799116","Indian Non-Government Company"
"U52209TR2012PLC008343","27-01-2012","DREAMS AGRO LIMITED","UNDER PROCESS OF STRIKING OFF","Public","Company Limited by Shares","500,000.00","500,000.00","Tripura","RoC-Shillong","Trading","KER CHOWMUHANI T G ROAD AGARTALA Tripura INDIA 799002","Indian Non-Government Company"
"U52335TR2012PTC008372","15-11-2012","BHAUMIK TRADELINK PRIVATE LIMITED","ACTIVE","Private","Company Limited by Shares","100,000.00","100,000.00","Tripura","RoC-Shillong","Trading","Post Box No - 129 Agartala West Tripura Tripura INDIA 799001","Indian Non-Government Company"
"U52399TR2010PTC008318","28-12-2010","PILAK MARKETING INDIA PRIVATE LIMITED","UNDER PROCESS OF STRIKING OFF","Private","Company Limited by Shares","500,000.00","150,000.00","Tripura","RoC-Shillong","Trading","JAGANNATH BARI ROAD, LIFELINE BUILDING 2ND FLOOR NEAR AGARTALA PRESS CLUB AGARTALA Tripura INDIA 799001","Indian Non-Government Company"
"U52399TR2011PTC008339","29-11-2011","SHOMELAL BAG BAZAR PRIVATE LIMITED","UNDER PROCESS OF STRIKING OFF","Private","Company Limited by Shares","1,000,000.00","1,000,000.00","Tripura","RoC-Shillong","Trading","Hawkers Corner, P.O. Agartala P.S. West Kotwali, Sadar Agartala Tripura INDIA 799001","Indian Non-Government Company"
"U52590TR2009PTC008278","13-11-2009","AIKAWA MULTI MARKETING PRIVATE LIMITED","STRIKE OFF","Private","Company Limited by Shares","200,000.00","100,000.00","Tripura","RoC-Shillong","Trading","JOY NAGAR MAIN ROAD, THAKUR BARI NEAR JUBO SAMAJ CLUB AGARTALA Tripura INDIA 799001","Indian Non-Government Company"
"U55101TR1979PTC001786","18-08-1979","MALANCHABAS COMPLEX PVT LTD","STRIKE OFF","Private","Company Limited by Shares","2,000,000.00","10,000.00","Tripura","RoC-Shillong","Trading","Ujjayanta Palace, Agartala Tripura INDIA","Indian Non-Government Company"
"U55101TR1991PTC003548","31-05-1991","SAMBIT HOTEL PVT LTD","STRIKE OFF","Private","Company Limited by Shares","5,000,000.00","20,000.00","Tripura","RoC-Shillong","Trading","WEST TRIPURA WEST TRIPURA TRIPURA Tripura INDIA","Indian Non-Government Company"
"U55101TR1997PTC005008","10-03-1997","SUKHAMANI HOTELS PRIVATE LIMITED","UNDER PROCESS OF STRIKING OFF","Private","Company Limited by Shares","100,000.00","100,000.00","Tripura","RoC-Shillong","Trading","B K ROADBANAMALI PUR AGARTALA TRIPURA Tripura INDIA 799001","Indian Non-Government Company"
"U55101TR2000PTC006211","13-06-2000","HOTEL TRIPURESHWARI PRIVATE LIMITED","STRIKE OFF","Private","Company Limited by Shares","1,000,000.00","120,000.00","Tripura","RoC-Shillong","Trading","SWASTI BAZAR SUPER MARKETH G B ROAD AGARTALA TRIPURA Tripura INDIA 799001","Indian Non-Government Company"
"U55101TR2000PTC006334","17-10-2000","HOTEL SIMRAN PRIVATE LIMITED","ACTIVE","Private","Company Limited by Shares","20,000,000.00","500,000.00","Tripura","RoC-Shillong","Trading","L N BARI ROADEAST KOTWALI AGARTALA TRIPURA Tripura INDIA","Indian Non-Government Company"
"U55101TR2001PTC006462","26-03-2001","HOTEL PRAMILA PRIVATE LIMITED","STRIKE OFF","Private","Company Limited by Shares","500,000.00","500,000.00","Tripura","RoC-Shillong","Trading","THAKUR-PALLI ROADAGARTALA WEST TRIPURA TRIPURA Tripura INDIA","Indian Non-Government Company"
"U55101TR2001PTC006615","7-09-2001","ELEMEL RESORTS & HOTELS PRIVATE LIMITED","STRIKE OFF","Private","Company Limited by Shares","500,000.00","100,000.00","Tripura","RoC-Shillong","Trading","MINISTER HILLNEAR VIP GUEST HOUSE KOHIMA NAGALAND Tripura INDIA 797001","Indian Non-Government Company"
"U55101TR2003PTC007251","3-11-2003","SUMRAJ HOTEL PRIVATE LIMITED","STRIKE OFF","Private","Company Limited by Shares","1,000,000.00","1,000,000.00","Tripura","RoC-Shillong","Trading","OLD THANA LANEWEST BANAMALIPUR AGARTALA TRIPURA Tripura INDIA 799001","Indian Non-Government Company"
"U55101TR2004PTC007579","10-12-2004","SHEROWALI INTERNATIONAL PRIVATE LIMITED","ACTIVE","Private","Company Limited by Shares","10,000,000.00","8,250,000.00","Tripura","RoC-Shillong","Trading","GHOSH PATTY SANTIPARANEAR TRIVENI GUEST HOUSE AGARTALA WEST TRIPURA Tripura INDIA 799001","Indian Non-Government Company"
"U55101TR2009PTC008258","24-03-2009","ANAGHA HOTELS PRIVATE LIMITED","STRIKE OFF","Private","Company Limited by Shares","1,000,000.00","100,000.00","Tripura","RoC-Shillong","Trading","SANTIPARA EAST SIDE, AGARTALA AGARTALA Tripura INDIA 799001","Indian Non-Government Company"
"U55101TR2009PTC008275","5-11-2009","FELICITAS HOTELS PRIVATE LIMITED","UNDER PROCESS OF STRIKING OFF","Private","Company Limited by Shares","3,000,000.00","100,000.00","Tripura","RoC-Shillong","Trading","PALACE COMPOUND AGARTALA Tripura INDIA 799001","Indian Non-Government Company"
"U55101TR2009PTC008276","6-11-2009","GREEN TOUCH HOTEL AND RESORTS PRIVATE LIMITED","ACTIVE","Private","Company Limited by Shares","17,000,000.00","13,000,000.00","Tripura","RoC-Shillong","Trading","PALACE COMPOUND AGARTALA Tripura INDIA 799001","Indian Non-Government Company"
"U55101TR2010PTC008303","2-08-2010","FELICITAS HOSPITALITY AND RESTAURANT PRIVATE LIMITED","ACTIVE","Private","Company Limited by Shares","1,000,000.00","200,000.00","Tripura","RoC-Shillong","Trading","C\O PRIYA MOTORS PRIVATE LTD, INDIRA PALLY (W) COMPOUND AGARTALA Tripura INDIA 799001","Indian Non-Government Company"
"U55101TR2011PTC008322","30-03-2011","RAJ CONTINENTAL HOTELS PRIVATE LIMITED","ACTIVE","Private","Company Limited by Shares","10,000,000.00","300,000.00","Tripura","RoC-Shillong","Trading","B.K. ROAD BANAMALIPUR AGARTALA Tripura INDIA 799001","Indian Non-Government Company"
"U55101TR2013PTC008414","20-12-2013","SHEROWALI (INDIA) HOTEL & RESORTS PRIVATE LIMITED","ACTIVE","Private","Company Limited by Shares","50,000,000.00","1,000,000.00","Tripura","RoC-Shillong","Trading","T. G. ROAD KRISHNANAGAR, NEAR SANKAR CHOWMAHAI AGARTALA Tripura INDIA 799001","Indian Non-Government Company"
"U55101TR2014PTC008419","3-02-2014","JONAREN HOSPITALITY AND ENTERTAINMENT PRIVATE LIMITED","ACTIVE","Private","Company Limited by Shares","100,000.00","100,000.00","Tripura","RoC-Shillong","Trading","SKUTALA ROAD EXTENSION, PALACE COMPOUND AGARTALA Tripura INDIA 799001","Indian Non-Government Company"
"U55204TR1999PTC005819","12-07-1999","TRIPURA RUBBER FIELD PRIVATE LIMITED","ACTIVE","Private","Company Limited by Shares","2,750,000.00","334,000.00","Tripura","RoC-Shillong","Trading","HARI GANGA BASAK ROAD, AGARTALA TRIPURA Tripura INDIA 799001","Indian Non-Government Company"
"U60200TR2010SGC008282","23-01-2010","TRIPURA URBAN TRANSPORT COMPANY LIMITED","ACTIVE","Private","Company Limited by Shares","100,000,000.00","2,500,000.00","Tripura","RoC-Shillong","Transport, storage and Communications","TRTC COMPLEX KRISHNANAGAR AGARTALA Tripura INDIA 799001","State Government Company"
"U60210TR1992PTC003699","28-04-1992","DAY NIGHT TOURS AND EXPRESS PVT LTD","STRIKE OFF","Private","Company Limited by Shares","300,000.00","10,500.00","Tripura","RoC-Shillong","Transport, storage and Communications","BATTLA. MELAR MAT ROAD AGARTALA Tripura INDIA 799001","Indian Non-Government Company"
"U60210TR1998PTC005393","16-04-1998","TRIPURA GOLDEN GOODS CARRIER CO INDIA PVT LTD","STRIKE OFF","Private","Company Limited by Shares","2,500,000.00","20,000.00","Tripura","RoC-Shillong","Transport, storage and Communications","99 MOTOR STAND ROADAGARTALA 1 DIST WEST TRIPURA TRIPURA Tripura INDIA 799001","Indian Non-Government Company"
"U60210TR2001PTC006464","26-03-2001","BOROK TRANSPORT PRIVATE LIMITED","STRIKE OFF","Private","Company Limited by Shares","1,000,000.00","1,000,000.00","Tripura","RoC-Shillong","Transport, storage and Communications","DUKMALI HATIKUMULUNG WEST TRIPURA TRIPURA Tripura INDIA","Indian Non-Government Company"
"U60231TR2010PTC008317","24-11-2010","FELICITAS LOGISTICS AND WAREHOUSING PRIVATE LIMITED","ACTIVE","Private","Company Limited by Shares","10,000,000.00","200,000.00","Tripura","RoC-Shillong","Transport, storage and Communications","PALACE COMPOUND (WEST) COLONEL CHOWMOHANI AGARTALA Tripura INDIA 799001","Indian Non-Government Company"
"U62100TR2006PTC008231","21-08-2006","NORTH EAST SHUTTLES PRIVATE LIMITED","ACTIVE","Private","Company Limited by Shares","150,000,000.00","125,000,000.00","Tripura","RoC-Shillong","Transport, storage and Communications","SURJYA ROAD AGARTALA Tripura INDIA 799001","Indian Non-Government Company"
"U62200TR1973PTC001445","1-09-1973","SALKAMA AIR LINES PVT LTD","STRIKE OFF","Private","Company Limited by Shares","1,000,000.00","2,500.00","Tripura","RoC-Shillong","Transport, storage and Communications","AGARTALA TRIPURAWEST TRIPURA TRIPURA Tripura INDIA","Indian Non-Government Company"
"U63022TR1999PTC005745","28-04-1999","JOYRAM FOOD PRODUCTS PRIVATE LIMITED","STRIKE OFF","Private","Company Limited by Shares","4,000,000.00","3,000.00","Tripura","RoC-Shillong","Transport, storage and Communications","NETAJI SUBHAS ROADAGARTALA WEST TRIPURA TRIPURA Tripura INDIA","Indian Non-Government Company"
"U63022TR2000PTC006267","3-08-2000","MATILAL AND GAURI FOOD & STORAGE PRIVATE LIMITED","ACTIVE","Private","Company Limited by Shares","17,000,000.00","14,089,000.00","Tripura","RoC-Shillong","Transport, storage and Communications","BADHARGHAT INDUSTRIAL ESTATE ARUNDHUTINAGAR AGARTALA Tripura INDIA 799003","Indian Non-Government Company"
"U63022TR2000PTC006370","11-12-2000","SHEROWALI HIMGHAR AND SERVICES PRIVATE LIMITED","ACTIVE","Private","Company Limited by Shares","5,000,000.00","4,970,000.00","Tripura","RoC-Shillong","Transport, storage and Communications","ASSAM AGARTALA ROAD CHAMPUR AGARTALA Tripura INDIA 799008","Indian Non-Government Company"
"U63022TR2004PTC007547","30-09-2004","TRIPURESWARI COLD STORAGE PRIVATE LIMITED","STRIKE OFF","Private","Company Limited by Shares","5,000,000.00","300,000.00","Tripura","RoC-Shillong","Transport, storage and Communications","KAMALA BHABANNETAJI SUBHAS ROAD AGARTALA TIRPURA Tripura INDIA","Indian Non-Government Company"
"U63040TR2006PTC008154","17-05-2006","MOUNT VISSION NET WORK MARKETING PRIVATE LIMITED","STRIKE OFF","Private","Company Limited by Shares","200,000.00","100,000.00","Tripura","RoC-Shillong","Transport, storage and Communications","ORIENT CHOWMUHANI,AGARTALA, TRIPURA, 799001 Tripura INDIA","Indian Non-Government Company"
"U63040TR2009PTC008255","15-01-2009","TRIPURA TOUR PACKAGES PRIVATE LIMITED","ACTIVE","Private","Company Limited by Shares","500,000.00","367,000.00","Tripura","RoC-Shillong","Transport, storage and Communications","NARAURA P. O. & P. S. - BISHALGARH BISHALGARH Tripura INDIA 799102","Indian Non-Government Company"
"U63040TR2009PTC008267","24-07-2009","TRIPURESWARI TOURS & TRAVELS PRIVATE LIMITED","ACTIVE","Private","Company Limited by Shares","100,000.00","100,000.00","Tripura","RoC-Shillong","Transport, storage and Communications","CHOWDHURY MANJIL , JOGENDRANAGAR OPPOSITE OF VIDYASAGARA GIRLS SCHOOL AGARTALA Tripura INDIA 799010","Indian Non-Government Company"
"U63090TR2004PTC007307","21-01-2004","SDC FREIGHT CARRIERS PRIVATE LIMITED","STRIKE OFF","Private","Company Limited by Shares","2,000,000.00","750,000.00","Tripura","RoC-Shillong","Transport, storage and Communications","144 MOTOR STAND ROADAGARTALA TRIPURA Tripura INDIA 799001","Indian Non-Government Company"
"U63090TR2008PTC008247","7-08-2008","TIWARY LOGISTICS PRIVATE LIMITED","ACTIVE","Private","Company Limited by Shares","500,000.00","500,000.00","Tripura","RoC-Shillong","Transport, storage and Communications","NARSINGARH,BHAGALPUR AGARTALA Tripura INDIA 799015","Indian Non-Government Company"
"U64200TR2007PTC008243","14-12-2007","AKASH TRIPURA PRIVATE LIMITED","UNDER PROCESS OF STRIKING OFF","Private","Company Limited by Shares","10,000,000.00","2,241,000.00","Tripura","RoC-Shillong","Transport, storage and Communications","JASHODA BHAWAN L.N. BARI ROAD AGARTALA Tripura INDIA 799001","Indian Non-Government Company"
"U64202TR2003PTC007289","22-12-2003","SANYOG NETWORKS PRIVATE LIMITED","ACTIVE","Private","Company Limited by Shares","1,000,000.00","750,000.00","Tripura","RoC-Shillong","Transport, storage and Communications","COLLEGE ROAD P.O AGARTALA COLLEGE AGARTALA Tripura INDIA 799004","Indian Non-Government Company"
"U64202TR2004PTC007495","12-08-2004","CONNOISSEURS TECHNOLOGIES PRIVATE LIMITED","ACTIVE","Private","Company Limited by Shares","2,000,000.00","900,000.00","Tripura","RoC-Shillong","Transport, storage and Communications","JAGANNATH BARI ROADWEST AGARTALA TRIPURA WEST AGARTALA TRIPURA Tripura INDIA 199001","Indian Non-Government Company"
